{
  "schema": "vrp.verdict/v1",
  "request_id": "4c6e3f68-8149-42d3-9e18-4e6db30f4a10",
  "verdict": "VERIFIED",
  "reason_code": "CONTRACT_PRESERVED",
  "completed_at": "2026-07-14T12:10:00Z",
  "evidence": {
    "schema": "vrp.evidence-reference/v1",
    "evidence_id": "evidence-000001",
    "digest": "sha256:0123456789abcdef0123456789abcdef0123456789abcdef0123456789abcdef",
    "created_at": "2026-07-14T12:10:00Z",
    "media_type": "application/vnd.vrp.evidence+json",
    "retrieval_status": "AVAILABLE"
  }
}